<?xml version="1.0"?>
<!DOCTYPE marca SYSTEM "../dtd/marca.dtd">
<marca>
    <nombre>Prueba</nombre>
    <productos>
        <productos fechaDePublicacion="1-01-2001">
            <nombre>Pruebita</nombre>
            <tipo>Probaci√≥n</tipo>
            <descripcion>Se prueba </descripcion>
            <precio>1000.0</precio>
        </productos>
    </productos>
</marca>
